{"schema_version":1,"envelope_id":"AR-1900-e1","envelope_revision":1,"task":"AR-1900","task_revision":5,"spec_ref":"specs/AR-1900.json","spec_revision":1,"outputs":[{"id":"scope","description":"Verify execution-envelope dependency scope."}],"non_goals":["Do not alter AR-1899 or earlier histories.","Do not bypass AR-1878 expiry or run formal/TLC."],"path_scope":{"read":["tools/handoffctl.py","tools/execution_lifecycle.py","tools/execution_abandonment.py","tools/execution_receipt.py","tools/assumption_revalidation.py","tools/change_drift.py","tools/command_results.py","tools/execution_envelope.py","tests","specs/AR-1900.json","envelopes/AR-1900-e1.json","tasks/AR-1900.md"],"write":["quality","specs","envelopes"]},"command_classes":{"read":{"allowed":true},"test":{"allowed":true,"timeout_seconds":900}},"evidence":[{"id":"scope","class":"contract-test","required":true}],"stop_conditions":[{"id":"scope","kind":"deny"},{"id":"expired-claim","kind":"deny"}]}
