{"schema_version":1,"envelope_id":"AR-1889-e2","envelope_revision":2,"task":"AR-1889","task_revision":5,"spec_ref":"specs/AR-1889.json","spec_revision":1,"outputs":[{"id":"recovery","description":"Verify exact expired terminal-result recovery."}],"non_goals":["Do not alter AR-1878 through AR-1888.","Do not force-clear, cross roots, or run formal/TLC."],"path_scope":{"read":["tools/handoffctl.py","tools/execution_lifecycle.py","tests","specs/AR-1889.json","envelopes/AR-1889-e2.json","tasks/AR-1889.md"],"write":["tools/handoffctl.py","tools/execution_lifecycle.py","tests","quality","specs","envelopes"]},"command_classes":{"read":{"allowed":true},"test":{"allowed":true,"timeout_seconds":900},"source-write":{"allowed":true,"timeout_seconds":900}},"evidence":[{"id":"recovery","class":"contract-test","required":true}],"stop_conditions":[{"id":"scope","kind":"deny"},{"id":"formal","kind":"deny"}]}
