{"command_classes":{"read":{"allowed":true,"timeout_seconds":120},"test":{"allowed":true,"timeout_seconds":900}},"envelope_id":"AR-1909-e1","envelope_revision":1,"evidence":[{"class":"mechanical","id":"bootstrap","required":true}],"non_goals":["Do not alter AR-1906 or earlier histories.","Do not create worktrees out of band.","Do not run formal/TLC."],"outputs":[{"description":"Authorized worktree bootstrap and retention test result.","id":"bootstrap"}],"path_scope":{"read":["tools","tests","tasks/AR-1906.md","specs/AR-1909.json","envelopes/AR-1909-e1.json","tasks/AR-1909.md"],"write":["quality"]},"schema_version":1,"spec_ref":"specs/AR-1909.json","spec_revision":1,"stop_conditions":[{"id":"scope","kind":"deny"}],"task":"AR-1909","task_revision":4}
