{"command_classes":{"read":{"allowed":true,"timeout_seconds":120},"test":{"allowed":true,"timeout_seconds":900}},"envelope_id":"AR-1906-e1","envelope_revision":1,"evidence":[{"class":"mechanical","id":"retention","required":true}],"non_goals":["Do not alter AR-1901 through AR-1905.","Do not run formal/TLC."],"outputs":[{"description":"Artifact-retention result.","id":"retention"}],"path_scope":{"read":["tools","tests","tasks/AR-1901.md","tasks/AR-1904.md","tasks/AR-1905.md","specs/AR-1906.json","envelopes/AR-1906-e1.json","tasks/AR-1906.md"],"write":["quality"]},"schema_version":1,"spec_ref":"specs/AR-1906.json","spec_revision":1,"stop_conditions":[{"id":"scope","kind":"deny"}],"task":"AR-1906","task_revision":4}
