{"schema_version":1,"envelope_id":"AR-1912-e1","envelope_revision":1,"task":"AR-1912","task_revision":5,"spec_ref":"specs/AR-1912.json","spec_revision":1,"outputs":[{"id":"scope","description":"Verify roles dependency scope."}],"non_goals":["Do not alter AR-1910, AR-1908, AR-1878, or earlier histories.","Do not alter product files, bypass expiry, use network, or run formal/TLC."],"path_scope":{"read":["tools/handoffctl.py","tools/execution_lifecycle.py","tools/execution_abandonment.py","tools/execution_receipt.py","tools/assumption_revalidation.py","tools/change_drift.py","tools/command_results.py","tools/execution_envelope.py","tools/resume_card.py","tools/retry_circuit.py","tools/task_spec.py","tools/resume_card_runtime.py","tools/run_command.py","tools/autonomy_limits.py","tools/roles.py","tests/test_roles.py","specs/AR-1912.json","envelopes/AR-1912-e1.json","tasks/AR-1912.md"],"write":["quality","specs","envelopes"]},"command_classes":{"read":{"allowed":true},"test":{"allowed":true,"timeout_seconds":900}},"evidence":[{"id":"scope","class":"contract-test","required":true}],"stop_conditions":[{"id":"scope","kind":"deny"},{"id":"expired-claim","kind":"deny"}]}
