{"schema_version":1,"envelope_id":"AR-1893-e1","envelope_revision":1,"task":"AR-1893","task_revision":5,"spec_ref":"specs/AR-1893.json","spec_revision":1,"outputs":[{"id":"schema","description":"Validate bounded envelope replacement schema."}],"non_goals":["Do not alter AR-1892 or AR-1891/1890 histories.","Do not bypass AR-1878 expiry or run formal/TLC."],"path_scope":{"read":["tools/handoffctl.py","tools/execution_lifecycle.py","tests","specs/AR-1893.json","envelopes/AR-1893-e1.json","tasks/AR-1893.md"],"write":["tools/handoffctl.py","tests","quality","specs","envelopes"]},"command_classes":{"read":{"allowed":true},"test":{"allowed":true,"timeout_seconds":900},"source-write":{"allowed":true,"timeout_seconds":900}},"evidence":[{"id":"schema","class":"contract-test","required":true}],"stop_conditions":[{"id":"scope","kind":"deny"},{"id":"expired-claim","kind":"deny"}]}
